{"actId":"vet-29-2025","date":"2025-11-27","deviceIdentifier":"29.25.001","id":"29.25.001","legislature":57,"method":"painel","question":"keepVeto","result":"overridden","session":"SESSÃO CONJUNTA Nº 026 - 27/11/2025","sourceUrl":"https://legis.senado.leg.br/dadosabertos/plenario/resultado/veto/dispositivo/46051","tallies":{"camara":{"abstention":0,"blank":0,"no":3,"obstruction":0,"presiding":0,"yes":1},"senado":{"abstention":1,"blank":0,"no":5,"obstruction":0,"presiding":1,"yes":0}},"votes":[{"house":"camara","memberId":7001,"name":"Adriana Ventura","official":"Não","party":"Novo","position":"no","uf":"SP"},{"house":"camara","memberId":7002,"name":"Afonso Hamm","official":"Não","party":"PP","position":"no","uf":"RS"},{"house":"camara","memberId":7003,"name":"Airton Faleiro","official":"Sim","party":"PT","position":"yes","uf":"PA"},{"house":"camara","memberId":7005,"name":"Alexandre Guimarães","official":"Não","party":"MDB","position":"no","uf":"TO"},{"house":"senado","memberId":8001,"name":"Alessandro Vieira","official":"Não","party":"MDB","position":"no","uf":"SE"},{"house":"senado","memberId":8002,"name":"Ciro Nogueira","official":"Não","party":"PP","position":"no","uf":"PI"},{"house":"senado","memberId":8003,"name":"Confúcio Moura","official":"Abstenção","party":"MDB","position":"abstention","uf":"RO"},{"house":"senado","memberId":8004,"name":"Davi Alcolumbre","official":"Art. 17","party":"União","position":"presiding","uf":"AP"},{"house":"senado","memberId":8005,"name":"Dr. Hiran","official":"Não","party":"PP","position":"no","uf":"RR"},{"house":"senado","memberId":285,"name":"Márcio Bitar","official":"Não","party":"PL","position":"no","uf":"AC"},{"house":"senado","memberId":5386,"name":"Professora Dorinha Seabra","official":"Não","party":"União","position":"no","uf":"TO"}],"votesAvailable":true}
