{"actId":"vet-3-2025","date":"2025-06-17","deviceIdentifier":"03.25.004","id":"03.25.004","legislature":57,"method":"cedula","question":"keepVeto","result":"overridden","session":"Sessão Conjunta nº 13 de 17/06/2025 às 12:00h","sourceUrl":"https://legis.senado.leg.br/dadosabertos/plenario/resultado/veto/dispositivo/45468","tallies":{"camara":{"abstention":1,"blank":0,"no":1,"obstruction":0,"presiding":0,"yes":1},"senado":{"abstention":1,"blank":2,"no":2,"obstruction":0,"presiding":0,"yes":0}},"votes":[{"house":"camara","memberId":7001,"name":"Adriana Ventura","official":"Sim","party":"NOVO","position":"yes","uf":"SP"},{"house":"camara","memberId":7002,"name":"Afonso Hamm","official":"Abstenção","party":"PP","position":"abstention","uf":"RS"},{"house":"camara","memberId":7003,"name":"Airton Faleiro","official":"Não","party":"PT","position":"no","uf":"PA"},{"house":"senado","memberId":8001,"name":"Alessandro Vieira","official":"Não","party":"MDB","position":"no","uf":"SE"},{"house":"senado","memberId":8002,"name":"Ciro Nogueira","official":"Abstenção","party":"PP","position":"abstention","uf":"PI"},{"house":"senado","memberId":8003,"name":"Confúcio Moura","official":"Não","party":"MDB","position":"no","uf":"RO"},{"house":"senado","memberId":8005,"name":"Dr. Hiran","official":"Branco","party":"PP","position":"blank","uf":"RR"},{"house":"senado","memberId":5386,"name":"Professora Dorinha Seabra","official":"Branco","party":"UNIÃO","position":"blank","uf":"TO"}],"votesAvailable":true}
