{"actId":"vet-17-2023","date":"2024-05-09","deviceIdentifier":"17.23.001","id":"17.23.001","legislature":57,"method":"cedula","question":"keepVeto","result":"kept","session":"Sessão Conjunta nº 4 de 09/05/2024 às 10:00h","sourceUrl":"https://legis.senado.leg.br/dadosabertos/plenario/resultado/veto/dispositivo/43265","tallies":{"camara":{"abstention":0,"blank":1,"no":1,"obstruction":0,"presiding":0,"yes":3},"senado":{"abstention":0,"blank":0,"no":0,"obstruction":0,"presiding":0,"yes":0}},"votes":[{"house":"camara","memberId":7001,"name":"Adriana Ventura","official":"Não","party":"NOVO","position":"no","uf":"SP"},{"house":"camara","memberId":7002,"name":"Afonso Hamm","official":"Sim","party":"PP","position":"yes","uf":"RS"},{"house":"camara","memberId":7003,"name":"Airton Faleiro","official":"Sim","party":"PT","position":"yes","uf":"PA"},{"house":"camara","memberId":7005,"name":"Alexandre Guimarães","official":"Branco","party":"MDB","position":"blank","uf":"TO"},{"house":"camara","memberId":7004,"name":"aj Albuquerque","official":"Sim","party":"PP","position":"yes","uf":"CE"}],"votesAvailable":true}
