{"actId":"vet-49-2023","date":"2024-05-09","deviceIdentifier":"49.23.001","id":"49.23.001","legislature":57,"method":"cedula","question":"keepVeto","result":"overridden","session":"Sessão Conjunta nº 4 de 09/05/2024 às 10:00h","sourceUrl":"https://legis.senado.leg.br/dadosabertos/plenario/resultado/veto/dispositivo/43825","tallies":{"camara":{"abstention":0,"blank":1,"no":3,"obstruction":0,"presiding":0,"yes":1},"senado":{"abstention":0,"blank":0,"no":5,"obstruction":0,"presiding":0,"yes":1}},"votes":[{"house":"camara","memberId":7001,"name":"Adriana Ventura","official":"Sim","party":"NOVO","position":"yes","uf":"SP"},{"house":"camara","memberId":7002,"name":"Afonso Hamm","official":"Não","party":"PP","position":"no","uf":"RS"},{"house":"camara","memberId":7003,"name":"Airton Faleiro","official":"Não","party":"PT","position":"no","uf":"PA"},{"house":"camara","memberId":7005,"name":"Alexandre Guimarães","official":"Branco","party":"MDB","position":"blank","uf":"TO"},{"house":"camara","memberId":7004,"name":"aj Albuquerque","official":"Não","party":"PP","position":"no","uf":"CE"},{"house":"senado","memberId":8001,"name":"Alessandro Vieira","official":"Sim","party":"MDB","position":"yes","uf":"SE"},{"house":"senado","memberId":8002,"name":"Ciro Nogueira","official":"Não","party":"PP","position":"no","uf":"PI"},{"house":"senado","memberId":8003,"name":"Confúcio Moura","official":"Não","party":"MDB","position":"no","uf":"RO"},{"house":"senado","memberId":8004,"name":"Davi Alcolumbre","official":"Não","party":"UNIÃO","position":"no","uf":"AP"},{"house":"senado","memberId":8005,"name":"Dr. Hiran","official":"Não","party":"PP","position":"no","uf":"RR"},{"house":"senado","memberId":5386,"name":"Professora Dorinha Seabra","official":"Não","party":"UNIÃO","position":"no","uf":"TO"}],"votesAvailable":true}
